CAMPAIGN_ID,CONTENT_TYPE,CAMPAIGN_DESCRIPTION,CREATIVE_ASSETS,MARKETING_COPY,A_B_TEST_NOTES,SENTIMENT_ANALYSIS
1,Social Media + Display,"Spring Fashion Launch targeting women 25-45 with new seasonal collection. Focus on sustainable materials, vibrant colors, and versatile pieces. Strategy includes Instagram influencer partnerships, Pinterest boards, and Facebook carousel ads.",,Refresh your spring wardrobe with sustainable style! Our new collection combines eco-friendly materials with trend-setting designs. Shop now and get 20% off your first spring purchase.,A/B Test: Version A (20% discount) outperformed Version B (free shipping) by 35% in conversion rate. Imagery with models in outdoor settings performed 28% better than studio shots.,
2,Email Marketing,"Q1 B2B email nurture series for decision makers. Six-email journey covering industry trends, thought leadership, case studies, and product education. Personalized content based on industry segment and company size.",,Subject Line: 3 Trends Reshaping Your Industry in 2024. Learn how innovative companies are cutting costs by 40% while improving efficiency.,"Best performing: Email 3 (case study) with 45% open rate, 12% CTR. Personalized subject lines increased opens by 22%. Tuesday 10AM sends performed best.",
3,Display + Retargeting,"Summer Sale campaign with aggressive discounts up to 60% off. Multi-channel display advertising with dynamic retargeting. Creative emphasizes urgency, scarcity, and deal value.",,"SUMMER SALE IS HERE! Up to 60% OFF Everything! Limited time only. Shop top brands, hottest styles, unbeatable prices. Free shipping on orders over $50. Sale ends July 15th!",Urgency messaging increased CTR by 48%. Countdown timers improved conversion by 31%. Retargeting ads showing previously viewed products had 4.2x higher conversion.,
4,Search + Content Marketing,"Brand awareness campaign targeting tech sector professionals. Strategy includes thought leadership content, industry reports, expert interviews, and educational resources.",,Navigate the evolving tech landscape with confidence. Download our comprehensive 2024 Tech Trends Report featuring insights from 500+ industry leaders.,Long-form content generated 3x more leads. Gated content strategy effective. Search ads for tech trends had lowest CPA at $23.,
5,Multi-Channel,"Black Friday mega sale campaign across all channels. Massive promotional push with doorbusters, flash sales, and exclusive early access for email subscribers.",,BLACK FRIDAY IS HERE! Doorbuster deals starting at midnight. Early VIP access for email subscribers. Shop the biggest deals of the year!,Mobile traffic exceeded 75%. Push notifications had 89% open rate. Early access emails generated 45% of day-one revenue.,
6,Social Media,New product teaser campaign building anticipation for upcoming tech product launch. Cryptic messaging and gradual reveal strategy.,,Something innovative is coming. Can you guess what it is? Follow for daily clues. Early bird pre-orders opening soon.,Teaser strategy generated 2.3M impressions. Waitlist sign-ups exceeded target by 340%.,
7,Email Marketing,Customer retention campaign targeting existing customers with personalized offers based on purchase history. Loyalty rewards and VIP experiences.,,"You are valued! Enjoy exclusive rewards: 25% off, early access to new collections, free shipping for life, and VIP customer service.",Tier-based personalization increased response by 67%. VIP tier had 89% retention rate.,
8,Display + Social,Holiday Gift Guide campaign featuring curated product recommendations. Interactive gift finder tool and expert recommendations.,,Find the perfect gift for everyone! Our Holiday Gift Guide features expertly curated selections. Free gift wrapping. Guaranteed delivery by Dec 24th.,Interactive gift finder had 56% completion rate. Cross-sell suggestions increased AOV by $43.,
9,LinkedIn B2B,"LinkedIn lead generation campaign targeting enterprise decision makers. Sponsored content, InMail campaigns, and thought leadership articles.",,Is your enterprise ready for digital transformation? Learn how Fortune 500 companies are reducing costs by 40%. Download our case study.,LinkedIn InMail had 42% open rate. Case study downloads qualified leads effectively.,
10,Search + Display,"Back to School campaign targeting parents and students. Product bundles, student discounts, and dorm essentials.",,Get ready for back to school! Student discounts on everything you need. 15% off with student ID. Free shipping over $50.,Bundle offers increased AOV by $67. August timing critical for this campaign.,
11,Influencer Marketing,"Influencer partnership series with micro and macro influencers across fashion, lifestyle, and beauty verticals.",,"Real people, real style. Check out how our brand ambassadors are styling our latest collection. Join the community!",Micro-influencers had best engagement rates at 8.7%. Video content 4x more effective than static posts.,
12,Email Re-engagement,Re-engagement campaign targeting users inactive for 90+ days. Win-back strategy with compelling offers.,,We miss you! Check out everything new. Special 30% off just for you. Come back and see what you have been missing!,Three-email series optimal. Final email had 31% open rate. 15% of recipients reactivated.,
13,Multi-Channel Launch,Premium membership program launch offering exclusive benefits. Tiered membership structure focused on high-value customers.,,"Introducing Premium Membership. Unlimited free shipping, early access to sales, exclusive pricing, priority support.",ROI calculator increased conversions 43%. Annual payment option had 68% take rate.,
14,Display Ads,Valentine Day Special campaign targeting couples with romantic gift ideas and special experiences.,,"Make this Valentine Day unforgettable! Romantic gifts, special experiences, guaranteed delivery by Feb 14th.",Emotional messaging resonated strongly. Gift bundle suggestions increased AOV by 52%.,
15,Search + Social,Mobile App Download Campaign promoting app-exclusive features and seamless mobile shopping experience.,,"Download our app for exclusive mobile-only deals! Push notifications for flash sales, easy checkout. Shop anywhere, anytime.",App install ads on social outperformed search by 3x. Push notification opt-in rate of 67%.,
16,Content Marketing,Sustainability Initiative Awareness campaign highlighting environmental commitments and eco-friendly products.,,"Join us in creating a sustainable future. Learn about our environmental commitments, carbon-neutral shipping, and eco-friendly products.",Authenticity crucial. Long-form content about sustainability efforts built trust. Eco-conscious audience willing to pay premium.,
17,Email Flash Sale,Flash Sale 48 Hours campaign with deep discounts and limited inventory to create urgency.,,FLASH SALE! 48 HOURS ONLY! Up to 70% off select items. Limited quantities available. Shop now before they are gone!,Countdown timers increased CTR by 58%. Mobile traffic dominated at 82%.,
18,Display + Email,Year-End Clearance campaign to clear inventory with deep discounts across all categories.,,Year-End Clearance! Final markdowns on everything. Up to 75% off. Last chance to save big!,Multi-wave email strategy kept campaign fresh. Deeper discounts over time created anticipation.,
19,Email Series,Webinar Series Promotion for B2B audience featuring industry experts and educational content.,,"Join our expert webinar series! Learn best practices, industry insights, and actionable strategies. Free registration.",Educational content positioned as valuable resource. Follow-up email with recording had 52% open rate.,
20,Social Proof,"Customer Testimonials Campaign featuring real customer stories, reviews, and user-generated content.",,"Hear from our customers! Real stories, real results. Join thousands of satisfied customers.",Video testimonials outperformed text by 4x. Specific results increased credibility.,
21,Search + Social,Cyber Monday Deals campaign with aggressive online-only promotions across popular products.,,"CYBER MONDAY! Online-only deals. Biggest discounts of the year. Tech deals, fashion steals, home essentials!",Search volume surged 12x. Site performance critical. Mobile optimization crucial with 79% mobile traffic.,
22,Email + Referral,Referral Program Launch incentivizing existing customers to refer friends with rewards.,,"Share the love! Refer a friend and you both get $25 off. The more you refer, the more you save!",Double-sided incentive crucial. Email sharing most common. Simplified process increased completion by 64%.,
23,Display Ads,New Market Expansion West Coast campaign introducing brand to new geographic market.,,"Now serving the West Coast! Same great products, now available in your area. Local warehouse means faster shipping!",Localized creative essential. Regional influencer partnerships built credibility.,
24,Video Marketing,Product Demo Video Series showcasing product features and benefits through educational content.,,See it in action! Our product demo series shows you how to get the most from your purchase. Step-by-step tutorials!,Video series kept viewers engaged. How-to content had highest completion rates.,
25,Email + Social,Anniversary Sale 5 Years celebration campaign thanking loyal customers with special offers.,,"Celebrating 5 years! Thank you for your support. Enjoy anniversary pricing, exclusive deals, and special surprises!",Nostalgic content resonated. Gratitude messaging strengthened emotional connection.,
